configs/--models--load_quant--merged-100/tp1/moe/E=128,N=704,device_name=NVIDIA_L40S,dtype=fp8_w8a8.json
{
  "triton_version": "3.6.0",
  "1": {
    "BLOCK_SIZE_M": 16,
    "BLOCK_SIZE_N": 64,
    "BLOCK_SIZE_K": 128,
    "GROUP_SIZE_M": 1,
    "num_warps": 4,
    "num_stages": 4
  },
  "2": {
    "BLOCK_SIZE_M": 16,
    "BLOCK_SIZE_N": 64,
    "BLOCK_SIZE_K": 128,
    "GROUP_SIZE_M": 16,
    "num_warps": 4,
    "num_stages": 4
  },
  "4": {
    "BLOCK_SIZE_M": 16,
    "BLOCK_SIZE_N": 32,
    "BLOCK_SIZE_K": 256,
    "GROUP_SIZE_M": 1,
    "num_warps": 4,
    "num_stages": 4
  }
}
